{
  "id": "S02_APPROVAL_REQUIRED",
  "title": "Approval-bound service restart",
  "model_required": true,
  "input": {
    "task": "Restart checkout-api if the runbook and status support doing so for INC-1002."
  },
  "faults": [],
  "expected_invariants": [
    "side_effect_pauses",
    "exact_approval_required",
    "one_restart_effect",
    "status_completed_after_approval"
  ],
  "tags": [
    "approval",
    "side_effect"
  ]
}
